cv_id,job_id,relevance,reason
MER00043NP,JOB_MER00042FN,0,"Although the candidate has experience with lean manufacturing methodologies and process optimization, the specific job requirements for automotive component release processes and German language knowledge are not mentioned in their CV. The candidate's expertise is more related to mechanical engineering and software experience."
MER00043AJ,JOB_MER00043I2,1,"Candidate has relevant experience in R&D, programming languages and tools used in the job description, and skills align with the required ones (e.g., Python, C++, MS Office)."
MER00043AJ,JOB_MER00041FN,1,"Candidate has relevant skills and experience in research and development, thermodynamics, and automotive engineering, aligning with the job requirements. Additionally, their education background and certifications demonstrate a strong foundation in mechanical engineering."
MER00043AJ,JOB_MER0003THB,0,"Although the candidate has programming skills and experience in research and development, their background is in automotive engineering rather than software engineering or AI/data science. Their skills and experience do not directly align with the job description."
MER00043AJ,JOB_MER00040G3,1,"Candidate has strong background in automotive engineering, research and development, and diagnostics, making them a suitable candidate for the Senior Technical Specialist role."
MER00043AJ,JOB_MER000440T,0,"While the candidate has experience in research and development, their skills and experience are not directly applicable to the backend product owner role at Mercedes-Benz Group China Ltd. The job requires expertise in autonomous driving, AI, and cloud platforms, which the candidate does not mention."
MER00043AJ,JOB_MER0003WC2,0,"Although the candidate has experience in research and development, the specific skills required for this Active Safety Customer Function Owner role are not clearly matched with their profile."
MER00043AJ,JOB_494743,0,The candidate's skills and experience are not closely aligned with the requirements of this Management Consultant role. Lack of relevant industry expertise and consulting experience.
MER00043AJ,JOB_505890,0,"The candidate lacks relevant technical expertise, specifically in data science and industrial AI, which are essential for the Senior Consultant role at Siemens Advanta."
MER00043AJ,JOB_504994,0,"Lack of experience in AI, machine learning, and data science, as well as a strong focus on automotive engineering and research and development, makes the candidate unsuitable for this role."
MER00043AJ,JOB_MER00042W1,1,"The candidate has relevant experience as an intern at Mercedes-Benz AG and is pursuing a degree in Vehicle Technology/Mechanical Engineering. They also possess skills in programming languages, evaluation tools, and MS Office, which align with the job requirements."
MER00043AJ,JOB_MER00040PN,0,"No direct experience in labor and social law, although relevant project on research and development may not be directly applicable."
MER00043AJ,JOB_MER00043WJ,0,"Candidate lacks experience in manufacturing and automotive diagnostics, which are critical for the Inline Technician role."
MER00043AJ,JOB_MER00043NP,1,"Candidate has relevant experience in automotive engineering and research and development, as well as skills in programming languages, evaluation tools, and MS Office."
MER00043AJ,JOB_MER00043AJ,1,"Matches required skills, experience, and location. Relevant job description."
MER00043AJ,JOB_MER0003N2B,0,"The candidate's skills and experience are not directly related to the job requirements, which focus on die casting and permanent gravity casting. The candidate's expertise lies in automotive engineering, research and development, and programming languages such as MATLAB, Python, and C++, which are not relevant to this specific job."
MER00043AJ,JOB_MER00043EC,0,"Candidate's skills and experience are not directly related to the job requirements, specifically die casting and chill casting. Although they have a strong foundation in thermodynamics and combustion engines, which might seem relevant at first glance, it does not match the specific tasks and qualifications required for this job."
MER00043AJ,JOB_MER00043CU,1,"Candidate has relevant work experience in automotive engineering and research and development, as well as programming skills and knowledge of thermodynamics. Their education and certifications align with the job requirements."
MER00043AJ,JOB_MER0003PNG,1,"Candidate has strong analytical and programming skills, relevant experience in research and development, and a degree in Vehicle Technology/Mechanical Engineering, making them suitable for the role of training to become a vehicle mechatronics engineer."
MER00043AJ,JOB_MER00042Z0,1,"Candidate has relevant experience in R&D, programming languages (MATLAB, Python), and evaluation tools (MDA, Canape Diadem, UniPlot). Additionally, they have a strong foundation in thermodynamics and combustion engines, which aligns with the job requirements."
MER00043AJ,JOB_MER0003NBY,0,"While the candidate has experience in research and development, the job description emphasizes mechanical skills, production facilities, and manufacturing systems, which are not directly related to their current role."
MER00043AJ,JOB_MER00043R5,0,"Lack of experience in body maintenance technology and vehicle construction, despite intern experience in research and development."
MER00043AJ,JOB_MER00043R1,0,"Although the candidate has experience in research and development, their skills and education do not directly align with the job requirements for vehicle mechatronics technician. The job requires specific knowledge of electric and hybrid drives, battery technologies, and high-voltage systems, which is not explicitly mentioned in the CV."
MER00043AJ,JOB_MER0003NUV,1,"Candidate has relevant experience in research and development, programming languages (MATLAB, Python), and evaluation tools (MDA, Canape Diadem). Their internship at Mercedes-Benz AG aligns with the job requirements."
MER00043AJ,JOB_MER00043QA,0,"Lack of relevant experience in automotive body shop and non-destructive testing, despite having skills in programming languages (MATLAB, Python) and evaluation tools. The candidate's background is primarily in research and development and exhaust gas turbocharging."
MER00043AJ,JOB_MER0003TE5,1,"Candidate has relevant experience in automotive engineering, programming languages (MATLAB, Python, C++), and evaluation tools (MDA, Canape Diadem, UniPlot). Their research and development background aligns with the job requirements for a Senior Program Manager - Virtual Integration role."
MER00043AJ,JOB_MER0003T8G,0,"Candidate lacks experience in production equipment management and has no direct experience with maintenance, cleaning tasks, and surface treatment plants."
MER00043AJ,JOB_MER0003UJ0,0,"Lack of experience in paintless dent repair and manufacturing, despite having an automotive engineering background."
MER00043AJ,JOB_MER000418L,0,"Candidate lacks direct experience in capacity management and supplier research development, despite relevant skills and education."
MER00043AJ,JOB_MER000404I,0,"Lack of backend development experience and expertise in Python, JavaScript, XML, and jQuery, which are essential for the role. Although the candidate has experience with programming languages such as MATLAB, C++, and proficiency in MS Office and evaluation tools, it does not align with the job requirements."
MER00043AJ,JOB_MER000404E,0,"Lack of C#/.NET development experience, no mention of ASP.NET project or GRC communication"
MER00043AJ,JOB_MER0003ZP6,0,"Candidate lacks experience in CAD customization using .NET/C# and VB, which is a critical skill for this role. Although they have worked with MATLAB, Python, and C++ in the past, their skills don't directly align with the job requirements."
MER00043AJ,JOB_MER000435L,0,"Although the candidate has strong analytical and problem-solving skills, their experience in automotive engineering and R&D is not directly relevant to the product management role at Mercedes-Benz Research and Development India Private Limited. The job requires experience with developer tools, platforms, and AI ML platforms, which are not mentioned in the candidate's CV."
MER00043AJ,JOB_MER0003Z0J,0,"Lack of relevant skills in Java and Spring Boot, which are key technologies mentioned in the job description."
MER00043AJ,JOB_MER00040VT,0,"The candidate's skills and experience are not directly related to cloud architecture, which is a key requirement for this job."
MER00043AJ,JOB_MER0003Y4X,1,"Candidate's research experience in exhaust gas turbochargers and their involvement in design and testing of such components aligns with the job responsibilities. Their proficiency in MATLAB, Python, C++, and MS Office also matches the job requirements."
MER00043AJ,JOB_MER0003SBL,1,"Candidate has relevant skills for backend development using Java and Spring Boot, and experience in automotive engineering and research and development, which aligns with the job requirements."
MER00043AJ,JOB_MER0003PMN,0,ERROR: Server disconnected
MER00043AJ,JOB_MER00043UE,0,"Candidate lacks expertise in Java full stack development and microservices, despite proficiency in programming languages like MATLAB, Python, and C++."
MER00043AJ,JOB_505156,0,ERROR: Server disconnected
MER00043AJ,JOB_504229,0,"Lack of relevant skills and experience in accounting, finance, or related fields."
MER00043AJ,JOB_504230,0,"ERROR: Cannot connect to host ollama-service:11434 ssl:default [Connect call failed ('10.106.136.8', 11434)]"
MER00043AJ,JOB_MER0003S4Y,0,"Lack of experience in AI Security, despite background in automotive engineering and research and development."
MER00043AJ,JOB_MER0003S8I,0,Lack of relevant skills in Information Security. No experience mentioned in CV in related field.
MER00043AJ,JOB_502282,0,"Candidate lacks relevant technical expertise in cybersecurity, IT forensics, and cloud environments; skills are mostly related to automotive engineering."
MER00043AJ,JOB_503304,0,"Candidate lacks relevant technical expertise in cloud DevOps and cybersecurity, with no experience in AWS or DevOps tools like Terraform or CI/CD pipelines."
MER00043AJ,JOB_MER00042QP,0,"Lack of technical skills in business informatics/data science and limited experience in IT operations, despite being a mechanical engineering student"
MER00043AJ,JOB_502623,0,"Candidate lacks relevant experience in software development for data & AI, with no mention of Python or Go proficiency and limited understanding of system design, performance optimization, and fault tolerance."
MER00043AJ,JOB_MER0003TJ8,0,"Candidate lacks domain expertise in finance and captive business units, which are essential requirements for the Data Scientist role."
MER00043AJ,JOB_MER00041K9,1,"Candidate has relevant experience in research and development, programming languages such as Python, and evaluation tools like MDA. Additionally, they are currently pursuing a degree in Vehicle Technology/Mechanical Engineering at Mercedes-Benz AG, which is the same university listed on their CV."
MER00043AJ,JOB_MER00042FN,1,"Candidate has relevant experience in release management and product data management through their internship at Mercedes-Benz AG, with skills matching the job requirements."
MER0003N2B,JOB_MER00043I2,0,"Job requirements do not mention metal casting, machining, or quality control, which are the candidate's main skills and experience."
MER0003N2B,JOB_MER00041FN,1,"Candidate has relevant experience in metal casting, machining, and quality control from their internship and apprenticeship. They also possess skills in CAD software, welding, and basic knowledge of mathematics and physics."
MER0003N2B,JOB_MER0003THB,0,"Candidate lacks relevant technical skills for a software engineer role, with no experience in AI/ML development or cloud platforms."
MER0003N2B,JOB_MER00040G3,0,"Lacks direct experience in automotive diagnostics, with a focus on metal casting and machining. While relevant skills exist, the job requires strong diagnostic knowledge."
MER0003N2B,JOB_MER000440T,0,"Lack of experience in autonomous driving AD, backend product design and development, as well as cloud platforms. While the candidate has relevant skills in metal casting and machining, they are not directly applicable to this role."
MER0003N2B,JOB_MER0003WC2,0,"Lack of experience in ADAS system and software development, as well as a lack of specific skills mentioned in the job description (e.g. ROS, Autoware, Apollo)."
MER0003N2B,JOB_494743,0,"Lack of relevant skills and experience for management consulting role. Only mentions metal casting and machining in CV, whereas the job requires expertise in strategy, digital change, and business operations."
MER0003N2B,JOB_505890,0,"Candidate lacks relevant technical expertise and experience in AI, Agentic Systems, and related domains. No clear connection to the job requirements."
MER0003N2B,JOB_504994,0,"The candidate's skills and experience do not align with the job requirements. The job requires expertise in artificial intelligence, data science, and cloud platforms, whereas the candidate's CV focuses on metal casting, machining, and quality control."
MER0003N2B,JOB_MER00042W1,1,"Candidate has relevant education and experience in mechanical engineering, metal casting, and quality control methods. Their skills and certifications align with the job requirements."
MER0003N2B,JOB_MER00040PN,0,"Job description focuses on labor and social law, while the candidate's skills and experience are in metal casting, machining, and quality control. The job requires German language proficiency for communication with employee representatives, which is not mentioned as a required skill or experience."
MER0003N2B,JOB_MER00043WJ,0,ERROR: Server disconnected
MER0003N2B,JOB_MER00043NP,0,ERROR: Server disconnected
MER0003N2B,JOB_MER00043AJ,0,ERROR: Server disconnected
MER0003N2B,JOB_MER0003N2B,0,ERROR: Server disconnected
MER0003N2B,JOB_MER00043EC,0,ERROR: Server disconnected
MER0003N2B,JOB_MER00043CU,0,ERROR: Server disconnected
MER0003N2B,JOB_MER0003PNG,0,ERROR: Server disconnected
MER0003N2B,JOB_MER00042Z0,0,ERROR: Server disconnected
MER0003N2B,JOB_MER0003NBY,0,ERROR: Server disconnected
MER0003N2B,JOB_MER00043R5,0,ERROR: Server disconnected
MER0003N2B,JOB_MER00043R1,0,"Candidate lacks relevant work experience in mechatronics and electric vehicle technology, and does not meet the requirement of having a good secondary school leaving certificate."
MER0003N2B,JOB_MER0003NUV,1,"The candidate's background in metal casting and machining, as well as their quality control experience, aligns with the job requirements. They also possess a strong foundation in mathematics and physics, which is essential for understanding vehicle systems."
MER0003N2B,JOB_MER00043QA,0,"The candidate lacks experience in non-destructive structural testing, sheet metal processing, and data processing, which are crucial skills for the Body Shop Operator - Door Adjuster role."
MER0003N2B,JOB_MER0003TE5,0,"Candidate lacks relevant experience in software development and virtualization tools, as well as embedded system testing tools. No direct connection to Senior Program Manager - Virtual Integration role."
MER0003N2B,JOB_MER0003T8G,0,"ERROR: Cannot connect to host ollama-service:11434 ssl:default [Connect call failed ('10.106.136.8', 11434)]"
MER0003N2B,JOB_MER0003UJ0,0,"Lack of experience in paintless dent repairs and automotive body repair, despite relevant skills in metal casting and machining."
MER0003N2B,JOB_MER000418L,0,"Candidate lacks experience in program steering, capacity management, and manufacturing knowledge. Only relevant skills are metal casting and machining."
MER0003N2B,JOB_MER000404I,0,"Candidate lacks relevant technical skills for Backend Developer position, with no experience in web development or related technologies."
MER0003N2B,JOB_MER000404E,0,"Lack of relevant technical skills, particularly in C#/.NET development, with no experience in ASP.NET or .NET development."
MER0003N2B,JOB_MER0003ZP6,0,"Candidate lacks experience in CAD CAE customization, especially with Siemens NX, and is currently pursuing a Bachelor's degree in Mechanical Engineering. Although they have relevant internship and apprenticeship experiences, they don't meet the required 3-6 years of experience."
MER0003N2B,JOB_MER000435L,0,"Candidate lacks relevant experience in product management, AI/ML platforms, and DevOps. Their skills are mostly related to metal casting, machining, and quality control."
MER0003N2B,JOB_MER0003Z0J,0,"Lack of relevant technical skills and experience for the Tech Lead role, with no direct connection to automotive engineering or software development."
MER0003N2B,JOB_MER00040VT,0,"Candidate lacks relevant technical expertise, specifically in cloud computing and architecture, which is a critical requirement for the IJR - Senior Cloud Architect role."
MER0003N2B,JOB_MER0003Y4X,0,"Candidate lacks required expertise in cloud, Kubernetes, and full-stack development for a Senior Tech Lead role."
MER0003N2B,JOB_MER0003SBL,0,"Candidate lacks relevant technical expertise, with no experience in Java, Spring Boot, or Angular. While they have skills in metal casting and machining, these are not applicable to the Backend Developer position."
MER0003N2B,JOB_MER0003PMN,0,"Lack of relevant skills: No experience with cloud development, data infrastructure operation, or data pipeline orchestration tools like Azure Data Factory, Amazon Data Pipeline, Apache Spark Databricks, Kafka, Confluent Cloud, or OpenSearch."
MER0003N2B,JOB_MER00043UE,0,"No relevant skills or experience found in the job description. Candidate's skills are related to metal casting and automobile construction, whereas the job requires expertise in Java full stack development."
MER0003N2B,JOB_505156,0,"Lack of relevant work experience in finance or accounting, despite skills in metal casting and machining"
MER0003N2B,JOB_504229,0,"Lack of relevant skills and experience for Accounting Professional role. No qualifications or experience in finance, accounting, or SAP."
MER0003N2B,JOB_504230,0,"Candidate lacks relevant experience in finance, accounting, and leadership roles. Only has experience in metal casting and machining."
MER0003N2B,JOB_MER0003S4Y,0,"Lack of relevant experience in AI security, as the candidate's skills are focused on metal casting and mechanical engineering."
MER0003N2B,JOB_MER0003S8I,0,"Lack of relevant experience in IT/Telecommunications and security, the candidate's skills are more aligned with metal casting and mechanical engineering."
MER0003N2B,JOB_502282,0,"Candidate lacks essential skills and experience for a Senior Cybersecurity Incident Responder role, focusing on incident response, IT forensics, and cloud environments. While relevant skills like CAD and quality control are mentioned, they do not align with the job's primary requirements."
MER0003N2B,JOB_503304,0,"Lack of relevant technical skills, specifically DevOps and Cloud Computing experience. The candidate's background in metal casting and automobile construction is not aligned with the job requirements."
MER0003N2B,JOB_MER00042QP,0,"Candidate lacks relevant technical skills for a Business Informatics/Data Science role, as well as lack of experience in IT and business functional areas."
MER0003N2B,JOB_502623,0,"Candidate lacks experience in software development, data science, and AI, which are key requirements for the role. Relevant skills and experience are in metal casting, machining, and quality control."
MER0003N2B,JOB_MER0003TJ8,0,"Job description does not require mechanical engineering or manufacturing skills, which are the candidate's strong expertise. "
MER0003N2B,JOB_MER00041K9,0,"Candidate lacks relevant experience in data engineering, AI, and knowledge graphs, which are crucial for the Intern Data and AI Research & Development Digitalization role at Mercedes-Benz AG."
MER0003N2B,JOB_MER00042FN,0,"Lack of relevant technical experience in automotive engineering, software release, and product data management. The candidate's background is in metal casting and machining, which may not be directly applicable to the job requirements."
MER00043EC,JOB_MER00043I2,0,"No relevant technical skills mentioned, focus on mechanical engineering and metal casting does not match automated driving and assistance systems requirements."
MER00043EC,JOB_MER00041FN,1,"Candidate has relevant skills in metal casting and machining, as well as experience with NX CAD design tools and understanding of automotive product development processes."
MER00043EC,JOB_MER0003THB,0,"Candidate lacks relevant technical skills, education, and experience for a software engineer role in AI & Data Value. No formal education required for the job and no prior work experience mentioned."
MER00043EC,JOB_MER00040G3,0,"Candidate lacks experience in automotive electronics, diagnostics, and systems, despite mentioning metal casting and machining skills."
MER00043EC,JOB_MER000440T,0,"Lack of relevant skills, no experience in autonomous driving AD industry or backend product design and development."
MER00043EC,JOB_MER0003WC2,0,"Lack of relevant experience and education in ADAS system development, vehicle engineering, or robotics. While the candidate has skills in metal casting and machining, they are not directly applicable to the job requirements."
MER00043EC,JOB_494743,0,"No relevant experience or skills mentioned in the job description, and the candidate's background is in mechanical engineering and metal casting, which does not align with the management consulting role at Siemens Advanta."
MER00043EC,JOB_505890,0,"Candidate lacks required technical skills and experience for the AI and agentic systems role, with no relevant work experience or certifications mentioned."
MER00043EC,JOB_504994,0,"Lack of relevant skills and experience in AI, machine learning, or data science, making it unlikely for the candidate to excel as a Senior Consultant in Agentic & Artificial Intelligence."
MER00043EC,JOB_MER00042W1,0,"Lacks experience in die casting and chill casting process, as well as expertise in CAD systems like Siemens NX, which are crucial for the job."
MER00043EC,JOB_MER00040PN,0,"No relevant skills or experience for a legal trainee position, and the candidate's background is in mechanical engineering and metal casting."
MER00043EC,JOB_MER00043WJ,0,"Lack of relevant experience in automotive manufacturing and electronics, despite strong technical skills in metal casting and machining."
MER00043EC,JOB_MER00043NP,0,"Candidate lacks experience in factory planning, engineering processes and lean manufacturing, which are essential for the Assembly Intern position."
MER00043EC,JOB_MER00043AJ,0,"Candidate lacks experience with evaluation tools like MDA Canape Diadem UniPlot, and has no formal education required for the job."
MER00043EC,JOB_MER0003N2B,1,"Candidate has relevant skills, education, and motivation for the job. The position requires a fresh start with a willingness to learn and develop skills, which aligns with the candidate's situation."
MER00043EC,JOB_MER00043EC,1,"Candidate's skills and passion for mechanical engineering, metal casting, and die casting match the job requirements. They also have a good secondary school leaving certificate."
MER00043EC,JOB_MER00043CU,1,"Candidate has relevant skills in metal casting, machining, and technical systems, as well as a passion for mechanical engineering. Although the job description is specific to vehicle mechatronics, the candidate's focus on technical skills and knowledge aligns with the training opportunity."
MER00043EC,JOB_MER0003PNG,0,"Candidate lacks experience in electric vehicles and mechatronics engineering, but has relevant skills in metal casting and machining. While passion for mechanical engineering is mentioned, it's unclear how this translates to the specific domain of vehicle mechatronics."
MER00043EC,JOB_MER00042Z0,0,"The candidate lacks experience in vehicle mechatronics and high-voltage technology, which is a crucial requirement for the job. While they have skills related to metal casting and machining, they are not directly applicable to the role."
MER00043EC,JOB_MER0003NBY,1,"Candidate has relevant skills in metal casting, machining, and industrial processes, which align with the job requirements."
MER00043EC,JOB_MER00043R5,1,"Candidate's skills in metal casting and machining align with the job requirements, and their education focuses on mechanical engineering."
MER00043EC,JOB_MER00043R1,0,"The candidate lacks experience in electric vehicle technologies and mechatronics engineering, as well as expertise in high-voltage systems and alternative drives, which are essential for this role."
MER00043EC,JOB_MER0003NUV,0,"Although the candidate has experience in metal casting and mechanical engineering, their skills do not align with the job description's focus on body maintenance technology. Additionally, their lack of formal education and work experience makes them a less suitable candidate for this specific role."
MER00043EC,JOB_MER00043QA,0,"No relevant skills or experience mentioned in the CV for a Body Shop Operator - Door Adjuster role, which requires 5+ years of automotive production experience or an Associate's degree in a technical trade."
MER00043EC,JOB_MER0003TE5,0,"Lack of relevant technical experience in embedded systems, sw development, and virtualization tools. No direct connection to mechanical engineering or die casting."
MER00043EC,JOB_MER0003T8G,1,"Candidate has relevant skills for die casting and chill casting, as mentioned in the job description."
MER00043EC,JOB_MER0003UJ0,0,"Candidate lacks experience in automotive body repair and rework, despite having skills relevant to metal casting and machining."
