cv_id,job_id,relevance,reason
MER00040PN,JOB_MER0003PNG,0,"Candidate lacks relevant work experience and skills in mechatronics engineering, automotive technology, or related fields."
MER00040PN,JOB_MER00042Z0,0,"Candidate lacks relevant skills and experience in vehicle mechatronics, alternative drive technologies, and electric/hybrid systems. Only basic knowledge of labor and social law is mentioned."
MER00040PN,JOB_MER0003NBY,0,"Lack of relevant technical skills and experience in mechanical engineering, despite having a law degree. The job description emphasizes technical talent and experience with complex manufacturing systems, which is not reflected in the candidate's CV."
MER00040PN,JOB_MER00043R5,0,"Candidate lacks relevant skills for body and vehicle construction mechanic, such as technical understanding of mathematics and physics, spatial imagination, and experience in vehicle maintenance."
MER00040PN,JOB_MER00043R1,0,"Candidate lacks relevant experience and skills in vehicle mechatronics technology, labor law is not directly applicable to this role."
MER00040PN,JOB_MER0003NUV,0,"Lack of relevant skills and experience for a body and vehicle construction mechanic role, despite having a law background."
MER00040PN,JOB_MER00043QA,0,"Job requirements emphasize hands-on experience in non-destructive testing, welding inspection, and automotive production, which is not directly related to the candidate's skills and experience."
MER00040PN,JOB_MER0003TE5,0,"Lack of relevant experience in embedded systems, virtualization, and agile development. The candidate's background is mostly in law and research assistant roles."
MER00040PN,JOB_MER0003T8G,0,"The candidate lacks experience in equipment management, maintenance, and cleaning tasks required for the role. While they have research and analytical skills, these are not directly applicable to equipment management."
MER00040PN,JOB_MER0003UJ0,0,"No relevant work experience or skills for Body Shop Rework Technician role. The candidate's background is in law and research, which doesn't align with the job requirements."
MER00040PN,JOB_MER000418L,1,"Candidate has relevant education and work experience in law, which is a key area for labor and social law. Additionally, they have skills such as research, analysis, and communication that are applicable to the internship role."
MER00040PN,JOB_MER000404I,0,"Lack of relevant experience in backend development, software development lifecycle, and full stack solutions. The candidate's expertise lies in labor and social law, which is not directly related to the job requirements."
MER00040PN,JOB_MER000404E,0,"Lack of relevant technical skills, no experience with C#, .NET development, and GRPC communication. Although candidate has research experience, it is not directly applicable to this job."
MER00040PN,JOB_MER0003ZP6,0,"Lack of relevant experience in CAD customization, .NET/C#, and VB programming."
MER00040PN,JOB_MER000435L,0,"Lack of experience in product management, AI/ML platforms, and DevOps practices. The candidate's background is more focused on labor and social law."
MER00040PN,JOB_MER0003Z0J,0,"Lack of relevant experience and skills for a Tech Lead role, with no mention of Java, Spring Boot, or Kubernetes in the CV."
MER00040PN,JOB_MER00040VT,0,"Lack of relevant experience in cloud architecture, networking and security. No direct experience with Azure or Microsoft products."
MER00040PN,JOB_MER0003Y4X,0,"Candidate lacks essential technical skills, such as cloud and kubernetes expertise, which are critical for the Senior Tech Lead role."
MER00040PN,JOB_MER0003SBL,0,"The candidate's skills and experience do not match the job requirements. The candidate has no experience in backend development using Java, Spring Boot, or Kotlin, which are essential for this role."
MER00040PN,JOB_MER0003PMN,0,"Lack of relevant experience in cloud infrastructure operation, data pipeline orchestration, and DevSecOps. The candidate's skills are more aligned with labor and social law."
MER00040PN,JOB_MER00043UE,0,"Lack of relevant technical skills, specifically Java full stack and microservices experience, is a significant gap between the job requirements and the candidate's CV."
MER00040PN,JOB_505156,0,"Lack of relevant experience in accounting and finance, despite education in law. Relevant skills in labor and social law are not applicable to this role."
MER00040PN,JOB_504229,0,ERROR: Server disconnected
MER00040PN,JOB_504230,0,"Candidate lacks relevant experience in accounting and finance, with only basic knowledge of Labor and Social Law. No applicable skills for the role of Accounting Team Lead at Siemens Limited."
MER00040PN,JOB_MER0003S4Y,0,"Lack of direct experience in AI Security and related technologies, as well as limited knowledge of specific compliance standards like ISO 27001 SOC and NIST."
MER00040PN,JOB_MER0003S8I,0,ERROR: Server disconnected
MER00040PN,JOB_502282,0,"Lack of relevant experience in cybersecurity, incident response, and IT security. The candidate's background in law and research is not directly applicable to the role."
MER00040PN,JOB_503304,0,"Lack of relevant technical skills, no experience in DevOps, Cloud Computing or Cybersecurity"
MER00040PN,JOB_MER00042QP,0,ERROR: Server disconnected
MER00040PN,JOB_502623,0,Lack of relevant skills and experience for software development engineer role. The candidate's background in labor and social law is not directly applicable to the position.
MER00040PN,JOB_MER0003TJ8,0,"The candidate lacks experience in finance and customer analytics, which are critical components of the Business Intelligence (Data Scientist) role. Their skills and education are more aligned with labor and social law."
MER00040PN,JOB_MER00041K9,0,ERROR: Server disconnected
MER00040PN,JOB_MER00042FN,0,"Lack of experience in automotive component release, electronics hardware release, and software release processes. No relevant certifications or exposure to Mercedes-Benz norms, DBL, standards, and Dialog."
MER00043WJ,JOB_MER00043I2,0,"Lack of experience in automated driving and driving assistance systems, no direct relation to job responsibilities."
MER00043WJ,JOB_MER00041FN,0,ERROR: Server disconnected
MER00043WJ,JOB_MER0003THB,0,"ERROR: Cannot connect to host ollama-service:11434 ssl:default [Connect call failed ('10.106.136.8', 11434)]"
MER00043WJ,JOB_MER00040G3,0,"ERROR: Cannot connect to host ollama-service:11434 ssl:default [Connect call failed ('10.106.136.8', 11434)]"
MER00043WJ,JOB_MER000440T,0,"ERROR: Cannot connect to host ollama-service:11434 ssl:default [Connect call failed ('10.106.136.8', 11434)]"
MER00043WJ,JOB_MER0003WC2,0,"Candidate lacks experience in ADAS system or software development, and the required degree is a master's degree which candidate only holds a high school diploma."
MER00043WJ,JOB_494743,0,"ERROR: Cannot connect to host ollama-service:11434 ssl:default [Connect call failed ('10.106.136.8', 11434)]"
MER00043WJ,JOB_505890,0,Lack of relevant skills and experience. Candidate's background in automotive manufacturing and quality control is not applicable to the AI and Agentic Systems role at Siemens.
MER00043WJ,JOB_504994,0,"Candidate lacks technical expertise in AI and Agentic Systems, as well as experience in data science and machine learning, making it unlikely for them to be a good fit for this role."
MER00043WJ,JOB_MER00042W1,0,"ERROR: Cannot connect to host ollama-service:11434 ssl:default [Connect call failed ('10.106.136.8', 11434)]"
MER00043WJ,JOB_MER00040PN,0,"No direct relation between the candidate's technical skills and the job requirements, as well as no experience in labor and social law."
MER00043WJ,JOB_MER00043WJ,1,"Candidate has similar job title, skills relevant to automotive manufacturing and quality control, with experience in assembly line production. Requisite qualifications align."
MER00043WJ,JOB_MER00043NP,1,"Candidate has relevant experience in automotive manufacturing and electronics quality methods, which aligns with the job requirements."
MER00043WJ,JOB_MER00043AJ,0,"Lacks direct experience in Otto engine development, exhaust gas turbocharging and design. Only relevant automotive manufacturing experience."
MER00043WJ,JOB_MER0003N2B,0,"Candidate lacks experience in die casting and permanent gravity casting, and does not have the required technical expertise or certifications for the role."
MER00043WJ,JOB_MER00043EC,0,"Lack of experience in die casting, chill casting and metal machining, despite having automotive manufacturing experience."
MER00043WJ,JOB_MER00043CU,1,"Candidate has relevant experience in automotive manufacturing, electronics quality methods, and troubleshooting electrical components. They also have a good understanding of quality control and assurance, which could be beneficial for the training role."
MER00043WJ,JOB_MER0003PNG,0,"Lacks direct experience in high-voltage systems, mechatronics engineering, and electric vehicle technology, despite having automotive manufacturing experience."
MER00043WJ,JOB_MER00042Z0,0,"Although candidate has experience with electronic components and quality control, the job requires specific expertise in mechatronics technology and alternative drive systems, which may not align with their current skills."
MER00043WJ,JOB_MER0003NBY,1,"Candidate has experience in automotive manufacturing, electronics quality methods, and troubleshooting electrical components, which are relevant skills for an industrial mechanic role at Mercedes-Benz AG."
MER00043WJ,JOB_MER00043R5,0,"The candidate's skills and experience are not directly related to body and vehicle construction, nor do they match the specific job requirements for Mercedes-Benz AG."
MER00043WJ,JOB_MER00043R1,0,"Lack of experience in mechatronics and electrical systems specific to vans & commercial vehicles, Mercedes-Benz AG. Candidate's background is mostly in automotive manufacturing."
MER00043WJ,JOB_MER0003NUV,0,"Lack of direct experience in body and vehicle construction mechanics, as well as Mercedes-Benz specific knowledge. The candidate's experience in automotive manufacturing is too broad."
MER00043WJ,JOB_MER00043QA,0,"Candidate lacks experience in body shop operations, door adjuster, and ultrasonic testing. Their skills are mostly related to automotive manufacturing and quality control."
MER00043WJ,JOB_MER0003TE5,0,"Candidate lacks experience in automotive electronics and virtualization tools, as well as expertise in agile software development. The required qualification for the position is a Bachelor of Engineering in Electrical Electronics/Computer Science or similar field."
MER00043WJ,JOB_MER0003T8G,0,Lack of experience in equipment management and Mercedes-Benz specific knowledge
MER00043WJ,JOB_MER0003UJ0,1,"Candidate has relevant skills and experience in automotive manufacturing, troubleshooting electrical components, and quality control checks, which are applicable to the Body Shop Rework Technician role."
MER00043WJ,JOB_MER000418L,0,"Lack of direct experience in program steering, capacity management, or a related field. The candidate's skills and education are more aligned with automotive manufacturing and electronics quality methods."
MER00043WJ,JOB_MER000404I,0,"Although candidate has experience with electronics and quality control, the job requires backend development skills, which are not mentioned in their CV."
MER00043WJ,JOB_MER000404E,0,"Lack of direct experience in C#/.NET development, electronics quality methods, and data engineering. While the candidate has automotive manufacturing experience, it is not directly relevant to this role."
MER00043WJ,JOB_MER0003ZP6,0,"Candidate lacks experience in CAD customization and .NET/C# programming, which are key requirements for the job."
MER00043WJ,JOB_MER000435L,0,"Lacks relevant experience in product management, AI/ML platforms, and developer tools. While candidate has experience in electronics quality methods and automotive manufacturing, it is not directly applicable to the Global Cognition CoE - Product Manager role."
MER00043WJ,JOB_MER0003Z0J,0,"Lacks relevant technical expertise, particularly in Spring Boot and Spring Cloud, as well as experience with relational databases like Postgres or Oracle."
MER00043WJ,JOB_MER00040VT,0,"Candidate lacks direct experience in cloud architecture and Azure, which is a critical requirement for the IJR - Senior Cloud Architect role."
MER00043WJ,JOB_MER0003Y4X,0,"Lack of relevant experience in cloud native development, security, and Kubernetes. The candidate's background is in automotive manufacturing, which does not align with the job requirements."
MER00043WJ,JOB_MER0003SBL,0,"Although the candidate has experience in electronics quality methods and troubleshooting electrical components, their skills are not directly applicable to the backend developer role required for this position. Additionally, there is a significant gap between the candidate's work experience and the job requirements."
MER00043WJ,JOB_MER0003PMN,0,"Lack of expertise in cloud computing, DevSecOps, and data infrastructure operation, as well as experience with AWS or Azure cloud platforms."
MER00043WJ,JOB_MER00043UE,0,"Candidate lacks essential skills for the role, specifically Java, full stack development, microservices, and Spring Boot expertise."
MER00043WJ,JOB_505156,0,"Lack of relevant technical expertise and experience in finance, accounting, and management"
MER00043WJ,JOB_504229,0,"Lack of relevant skills and experience in finance and accounting, with no certification or training in IFRS or SAP."
MER00043WJ,JOB_504230,0,"Job requires accounting and finance expertise, which is not mentioned in the candidate's CV."
MER00043WJ,JOB_MER0003S4Y,0,"Lack of direct experience in AI security, despite relevant certifications and skills in automotive manufacturing and electronics quality methods. The candidate's expertise is not directly applicable to the AI Security role."
MER00043WJ,JOB_MER0003S8I,0,"Lack of technical expertise in IT security consulting, with only automotive manufacturing experience and no relevant certifications or education in computer science."
MER00043WJ,JOB_502282,0,"Lack of relevant skills and experience in cybersecurity, especially in cloud environments, incident response, forensics, and vulnerability management."
MER00043WJ,JOB_503304,0,ERROR: Server disconnected
MER00043WJ,JOB_MER00042QP,0,ERROR: Server disconnected
MER00043WJ,JOB_502623,0,ERROR: Server disconnected
MER00043WJ,JOB_MER0003TJ8,0,ERROR: Server disconnected
MER00043WJ,JOB_MER00041K9,0,ERROR: Server disconnected
MER00043WJ,JOB_MER00042FN,0,ERROR: Server disconnected
MER00043NP,JOB_MER00043I2,0,"ERROR: Cannot connect to host ollama-service:11434 ssl:default [Connect call failed ('10.106.136.8', 11434)]"
MER00043NP,JOB_MER00041FN,0,"ERROR: Cannot connect to host ollama-service:11434 ssl:default [Connect call failed ('10.106.136.8', 11434)]"
MER00043NP,JOB_MER0003THB,0,"ERROR: Cannot connect to host ollama-service:11434 ssl:default [Connect call failed ('10.106.136.8', 11434)]"
MER00043NP,JOB_MER00040G3,0,"Lack of experience in After-Sales Diagnostics and Telematics, despite mentioning relevant skills like 'Power BI and Related Software' and 'Good Communication and Presentation Skills'."
MER00043NP,JOB_MER000440T,0,"Candidate lacks experience in autonomous driving AD industry, specifically on backend product design and development, with only 6 months of experience compared to the required 5 years."
MER00043NP,JOB_MER0003WC2,0,"ERROR: Cannot connect to host ollama-service:11434 ssl:default [Connect call failed ('10.106.136.8', 11434)]"
MER00043NP,JOB_494743,0,"Candidate is a recent graduate with limited experience, which does not align with the requirements of a management consultant role."
MER00043NP,JOB_505890,0,"Candidate lacks essential experience in AI and machine learning, as well as industry-specific knowledge."
MER00043NP,JOB_504994,0,"Candidate lacks experience in agentic AI frameworks, foundation models, and multi-agent systems, which are crucial for the Senior Consultant role at Siemens AG."
MER00043NP,JOB_MER00042W1,0,"While the candidate has experience with lean manufacturing methodologies and process optimization, the job description emphasizes exterior attachments for MB.EA-L SUVs, MHA & Radomes, which is a specific area not explicitly mentioned in the candidate's CV."
MER00043NP,JOB_MER00040PN,0,"Candidate is a recent mechanical engineering graduate with no background in labor and social law, making them unsuitable for this HR-focused internship."
MER00043NP,JOB_MER00043WJ,1,"Candidate has relevant experience in lean manufacturing methodologies, Power BI, and Microsoft Office Suite, which are required for the Inline Technician role. Additionally, their Mechanical Engineering background is a good match for the job requirements."
MER00043NP,JOB_MER00043NP,1,"Candidate has relevant skills and experience in Lean Manufacturing Methodologies, Information System Experience, Power BI, and Microsoft Office Suite, making them a strong fit for the Assembly Intern position."
MER00043NP,JOB_MER00043AJ,0,"Candidate lacks direct experience with exhaust gas turbocharging and testing, which is a critical aspect of the job."
MER00043NP,JOB_MER0003N2B,0,"Although the candidate has relevant skills like Lean Manufacturing Methodologies, they lack direct experience in die casting and permanent gravity casting. Their current role as an Assembly Intern at Mercedes-Benz Vans, LLC doesn't align with the specific requirements of the job."
MER00043NP,JOB_MER00043EC,0,"Although the candidate has experience with lean manufacturing methodologies and process optimization, the job requires specific skills in die casting and chill casting which are not mentioned in their CV. Additionally, the job is for a full-time training program at Mercedes-Benz AG, which may be a mismatch for someone currently working as an assembly intern."
MER00043NP,JOB_MER00043CU,0,"While the candidate has experience with lean manufacturing methodologies, their skills and education don't seem to match the requirements of a vehicle mechatronics technician, which is a specialized role. "
MER00043NP,JOB_MER0003PNG,0,"Lack of experience in mechatronics engineering and electric vehicle technology, despite relevant skills in lean manufacturing and process optimization."
MER00043NP,JOB_MER00042Z0,0,"The candidate's skills and experience are more aligned with the job of an Assembly Intern at Mercedes-Benz Vans, LLC, rather than a vehicle mechatronics technician. The job requires specific knowledge of electric vehicles, alternative drive technologies, and high-voltage systems, which is not mentioned in the candidate's CV."
MER00043NP,JOB_MER0003NBY,1,"Candidate has relevant experience in lean manufacturing methodologies, process optimization and problem-solving from their internship at Mercedes-Benz Vans, LLC. Additionally, they have a strong foundation in mechanical engineering with a recent degree from Clemson University."
MER00043NP,JOB_MER00043R5,0,"Although the candidate has experience with manufacturing and problem-solving, their skills do not directly align with the specific requirements of body maintenance technology and vehicle construction at Mercedes-Benz AG. The job requires specialized knowledge in areas like repair painting and quality assurance measures, which are not mentioned in the candidate's CV."
MER00043NP,JOB_MER00043R1,0,"Lack of relevant experience in mechatronics, electrical systems and alternative drive technologies. The candidate's skills are mostly related to mechanical engineering and lean manufacturing."
MER00043NP,JOB_MER0003NUV,0,"Although the candidate has experience with mechanical engineering and process optimization, the job description specifically requires body maintenance technology and Mercedes-Benz AG expertise. The candidate's skills in Information System Experience, Power BI, and Microsoft Office Suite are not directly relevant to this role."
MER00043NP,JOB_MER00043QA,0,"Lack of experience with spot welding, non-destructive structural testing and welding technology is a significant gap between the required skills and the candidate's background in lean manufacturing methodologies."
MER00043NP,JOB_MER0003TE5,1,"Candidate has relevant experience in lean manufacturing methodologies, power BI, and Microsoft Office Suite. Their work experience as an Assembly Intern at Mercedes-Benz Vans, LLC is also a good fit for the company."
MER00043NP,JOB_MER0003T8G,1,"Candidate has experience with lean manufacturing methodologies and process optimization, relevant to the job description. Additionally, their mechanical engineering background and power BI knowledge aligns with the requirements."
MER00043NP,JOB_MER0003UJ0,1,"Candidate has relevant experience in lean manufacturing methodologies, power BI, and process optimization, which aligns with the job requirements."
MER00043NP,JOB_MER000418L,1,"Candidate meets most requirements, especially with relevant skills in lean manufacturing methodologies, process optimization, and data analysis. Additionally, the candidate's experience as an assembly intern at Mercedes-Benz Vans, LLC is directly related to the internship in Program Steering."
MER00043NP,JOB_MER000404I,0,"Although candidate has a mechanical engineering background, there is no explicit mention of programming skills or experience in backend development. The job description emphasizes microservice-based architecture and Python services, which are not directly mentioned in the candidate's CV."
MER00043NP,JOB_MER000404E,0,"Lack of direct experience with C#/.NET development, insufficient expertise in ASP.NET and GRPC communication."
MER00043NP,JOB_MER0003ZP6,0,"Candidate lacks experience in CAD customization, specifically with Siemens NX, and does not meet the required 3-6 years of relevant experience."
MER00043NP,JOB_MER000435L,0,"Lack of experience in product management, AI/ML platforms, and DevOps. Only relevant skills are related to manufacturing and engineering."
MER00043NP,JOB_MER0003Z0J,0,"Although candidate has experience in manufacturing and lean methodologies, they lack direct experience with IT/Telecommunications and Java programming, which are crucial for the Tech Lead role at MBRDI."
MER00043NP,JOB_MER00040VT,0,"Candidate lacks experience in cloud architecture and Azure specific skills, despite having experience with IT systems."
MER00043NP,JOB_MER0003Y4X,0,"Candidate lacks relevant experience in cloud native applications and modern identity management systems. Their experience is in lean manufacturing methodologies, which is not directly applicable to this role."
MER00043NP,JOB_MER0003SBL,0,"Candidate lacks experience in backend development using Java and Spring Boot, and frontend frameworks such as Angular and TypeScript. Their skills and experience are more aligned with Lean Manufacturing Methodologies and Process Optimization."
MER00043NP,JOB_MER0003PMN,1,"Relevant skills: Data Infrastructure Operation, Lean Manufacturing Methodologies, Process Optimization and Problem Solving. Although some requirements mention cloud experience, the candidate has experience with Power BI, Microsoft Office Suite and process optimization which can be adapted."
MER00043NP,JOB_MER00043UE,0,"Lack of relevant Java experience, with only a brief mention of being an Assembly Intern at Mercedes-Benz Vans, LLC."
MER00043NP,JOB_505156,0,"Lack of relevant technical accounting experience and IFRS knowledge. No direct experience in financial governance, team development or leadership."
MER00043NP,JOB_504229,0,"Lack of finance experience and knowledge of IFRS, SAP, and Ind AS. Relevant skills are more aligned with mechanical engineering roles."
MER00043NP,JOB_504230,0,"Lack of finance experience and no mention of accounting standards, GAAP, or IFRS. The candidate's skills are more aligned with process optimization and lean manufacturing."
MER00043NP,JOB_MER0003S4Y,0,"Candidate lacks experience in AI security, as well as specific knowledge of AI compliance standards and frameworks. Only mentions 'strong understanding of security principles' without any concrete examples."
MER00043NP,JOB_MER0003S8I,0,"Lack of experience in Information Security Consulting and no relevant certifications like CISA or CISSP. Relevant skills are present, but not enough to cover the requirements of the job."
MER00043NP,JOB_502282,0,"Lack of relevant skills and experience in Cybersecurity, Incident Response, Cloud environments and IT Security"
MER00043NP,JOB_503304,0,"Candidate lacks experience in DevOps and AWS, with only 6 months of experience as an Assembly Intern. No relevant certifications or education in Cybersecurity or related fields."
MER00043NP,JOB_MER00042QP,0,"Job requires business administration and data science knowledge, while the candidate's CV highlights mechanical engineering experience and skills in lean manufacturing."
MER00043NP,JOB_502623,0,"Although the candidate has a mechanical engineering background, they lack direct experience in software development and AI, which is a critical requirement for this role. The job description emphasizes deep systems work, cross-disciplinary problem-solving, and leading technical strategy, which the candidate's skills don't directly align with."
MER00043NP,JOB_MER0003TJ8,1,"Candidate has relevant experience in data analysis, lean manufacturing, and process optimization, which aligns with the job requirements. Their skills in Power BI and Microsoft Office Suite also match the job description."
MER00043NP,JOB_MER00041K9,1,"Candidate has relevant skills in process optimization, lean manufacturing methodologies, and data analysis (Power BI), which are applicable to the Intern Data and AI Research & Development Digitalization role at Mercedes-Benz AG."
