cv_id,job_id,relevance,reason
MER00043I2,JOB_MER00043I2,1,"Candidate has relevant skills, education and experience for the job in automated driving and driving assistance systems at Mercedes-Benz AG."
MER00043I2,JOB_MER00041FN,1,"Candidate has a degree in Computer Science, relevant courses and software tools mentioned. Additionally, they have experience with programming languages, operating systems, and problem-solving skills, making them suitable for the role."
MER00043I2,JOB_MER0003THB,1,"Candidate has relevant skills in programming languages, software tools, and operating systems. They also have experience with problem-solving, analytical, and logical thinking."
MER00043I2,JOB_MER00040G3,0,"While the candidate has relevant skills and experience in automotive technology, they are currently a part-time working student with limited work experience. The job requires full-time employment."
MER00043I2,JOB_MER000440T,0,"While the candidate has relevant skills and experience, their current degree status (studying for the 4th semester) and full-time job requirement do not align with the full-time position described in the job posting."
MER00043I2,JOB_MER0003WC2,0,"Lacks experience in Active Safety functions, Automotive Industry and ADAS system development. While the candidate has a degree in Computer Science (Automotive Technology), the job requires at least 3 years of experience in ADAS system or software development."
MER00043I2,JOB_494743,0,"The candidate lacks experience in management consulting, strategy, and the specific domain of Siemens Advanta, which is a significant requirement for this role."
MER00043I2,JOB_505890,0,No match for key requirements: Master's degree in Computer Science or related fields and experience with genai applications.
MER00043I2,JOB_504994,0,"Lack of relevant experience in AI, Agentic Systems and Industrial AI. Despite having a degree in Computer Science with focus on Automotive Technology, the candidate's skills and experience don't align closely enough with the job requirements."
MER00043I2,JOB_MER00042W1,1,"The candidate has a strong match in terms of skills and experience, particularly in the field of automotive technology and software development. Their relevant education and coursework also align with the job requirements."
MER00043I2,JOB_MER00040PN,0,"No experience in labor and social law, despite being a part of the Human Resources department at Mercedes-Benz AG. The role requires expertise in this area, which is not explicitly mentioned in the CV."
MER00043I2,JOB_MER00043WJ,0,"Lack of experience in automotive manufacturing, electronics, and quality methods. The candidate's skills are more focused on IT and programming languages."
MER00043I2,JOB_MER00043NP,0,"Lack of relevant skills for a production-focused role. While the candidate has programming and IT skills, they don't have experience with lean manufacturing or process optimization."
MER00043I2,JOB_MER00043AJ,1,"Candidate has a degree in Computer Science (Automotive Technology) and relevant courses, which aligns with the job requirements. They also have programming skills, familiarity with IT environments, and problem-solving skills, making them a suitable candidate for the role."
MER00043I2,JOB_MER0003N2B,0,"The candidate lacks relevant skills and experience for a die casting mechanic position, with no mention of metalworking or manufacturing expertise in their CV."
MER00043I2,JOB_MER00043EC,0,"The candidate lacks experience in die casting and chill casting, as well as metalworking skills, which are essential for the job."
MER00043I2,JOB_MER00043CU,0,"Lack of experience in electrical engineering, vehicle mechatronics technician role requires hands-on experience with electrical systems and mechanics"
MER00043I2,JOB_MER0003PNG,1,"Candidate has a relevant degree in Computer Science (Automotive Technology) and skills such as programming languages, operating systems, and software tools. The job description requires knowledge of IT environments, problem-solving skills, and strong analytical thinking, which are also mentioned in the candidate's CV."
MER00043I2,JOB_MER00042Z0,0,"The candidate's skills and education do not directly align with the job requirements for a vehicle mechatronics technician. The candidate has programming skills but no experience with electrical systems or high-voltage technology, which are crucial for this role."
MER00043I2,JOB_MER0003NBY,0,"Although the candidate has a degree in Computer Science, there is no mention of mechanical engineering or technical skills required for an industrial mechanic role. Additionally, the job requires specific manufacturing knowledge and experience with complex systems, which may not align with the candidate's background."
MER00043I2,JOB_MER00043R5,0,"Job requires hands-on experience in vehicle maintenance and repair, while the candidate's background is in Computer Science (Automotive Technology) and lacks relevant work experience."
MER00043I2,JOB_MER00043R1,0,"The job requires extensive technical knowledge and experience in mechatronics, automotive technology, and electrical systems. The candidate's skills are limited to programming languages (Python, C++, Java), operating systems (Windows), and software tools (MS Office, Git, Jira)."
MER00043I2,JOB_MER0003NUV,0,"The candidate's skills and education do not align with the job requirements. They lack experience in body maintenance technology, which is a specific area of focus for this training."
MER00043I2,JOB_MER00043QA,0,"The job requires extensive experience in non-destructive structural testing, welding technology, and automotive production, which is not explicitly mentioned in the candidate's CV. Additionally, the job is full-time, while the candidate is a part-time working student."
MER00043I2,JOB_MER0003TE5,0,"Lack of experience in virtualization tools, and the job requires strong expertise in these areas."
MER00043I2,JOB_MER0003T8G,0,"Although the candidate has relevant technical skills, their experience is not directly related to equipment management in a production environment. The job requires specific knowledge of machine operation and supervision, which is not explicitly mentioned in the CV."
MER00043I2,JOB_MER0003UJ0,0,"Lack of relevant experience in automotive body repair and rework, as well as metal finishing techniques"
MER00043I2,JOB_MER000418L,1,"Candidate has relevant skills and education for the role, specifically in Computer Science (Automotive Technology) with experience in IT environments."
MER00043I2,JOB_MER000404I,1,"Candidate has strong skills in Python, C++, Java, and software development, which aligns with the job requirements. Additionally, their experience in IT environments and problem-solving skills are also relevant to the role."
MER00043I2,JOB_MER000404E,1,"Candidate has strong programming skills, including C++, Java, and familiarity with IT environments. Relevant experience in software development, problem-solving, and analytical thinking is also present."
MER00043I2,JOB_MER0003ZP6,0,"Lack of direct experience with NX Open API, scripting XML, and .NET/C# programming languages. Relevant experience is required for this role."
MER00043I2,JOB_MER000435L,0,"Candidate lacks experience in AI/ML platforms, developer tools, and platform engineering, which are crucial for the Global Cognition CoE - Product Manager role."
MER00043I2,JOB_MER0003Z0J,1,"Candidate has relevant technical skills, especially in Java and programming languages. The candidate's educational background in Computer Science (Automotive Technology) aligns with the job requirements."
MER00043I2,JOB_MER00040VT,0,"Candidate lacks hands-on experience in Azure architecture, with only 4 years of experience mentioned. Required expertise is extensive and requires a strong understanding of cloud security and compliance frameworks."
MER00043I2,JOB_MER0003Y4X,0,"Candidate lacks experience with cloud-native development and specific tools like Kubernetes, AWS, and Azure. While they have relevant skills in programming languages and software tools, the job requires expertise in cloud and Kubernetes specifically."
MER00043I2,JOB_MER0003SBL,1,"Candidate has strong affinity for IT and relevant programming skills in Java, making them a suitable candidate for the backend developer position."
MER00043I2,JOB_MER0003PMN,1,"Candidate has relevant skills in software development, cloud platforms, and data infrastructure, with experience in programming languages like Python and C++. Their background in Computer Science (Automotive Technology) aligns with the job requirements."
MER00043I2,JOB_MER00043UE,0,"Although the candidate has programming skills in Java, their experience and specific technologies mentioned (Kubernetes, JUnit, Sonar) don't match the job requirements. Additionally, the job is full-time which isn't suitable for a part-time working student."
MER00043I2,JOB_505156,0,"The candidate lacks relevant experience in finance and accounting, and the required expertise is too specialized for their background in Computer Science."
MER00043I2,JOB_504229,0,"Lack of relevant skills, experience, and expertise in finance and accounting. While the candidate has a degree in Computer Science, there is no direct connection to accounting or finance."
MER00043I2,JOB_504230,0,"Candidate lacks experience in finance, accounting, and industry-specific knowledge. No relevant skills mentioned for the role."
MER00043I2,JOB_MER0003S4Y,0,"Candidate is currently studying for the 4th semester and expected graduation date is December 2028, which may not align with the full-time job requirement."
MER00043I2,JOB_MER0003S8I,0,"Lack of relevant experience in security consulting and cloud security, with only basic knowledge of security frameworks."
MER00043I2,JOB_502282,0,"The candidate lacks experience in incident response, forensics, and cloud environments, which are crucial for this role. Additionally, the candidate's education and skills do not align with the job requirements."
MER00043I2,JOB_503304,0,"Lack of experience with cloud DevOps and Cybersecurity, relevant skills in Cloud Computing are more related to AWS certifications such as SysOps Administrator or Developer."
MER00043I2,JOB_MER00042QP,0,"No mention of automated driving and driving assistance systems, and the candidate's focus is on Business Informatics/Data Science instead."
MER00043I2,JOB_502623,0,"Job requires a strong background in AI and machine learning, which is not explicitly mentioned in the candidate's CV."
MER00043I2,JOB_MER0003TJ8,0,"The candidate's skills and experience in computer science, programming languages, and IT environments are not directly relevant to the Business Intelligence (Data Scientist) role at Mercedes-Benz Mobility & Technology Service (Beijing) Co., Ltd. The job requires expertise in AI and GenAI algorithms, machine learning, and data visualization techniques, which the candidate lacks."
MER00043I2,JOB_MER00041K9,1,"Candidate has relevant education (Computer Science) and skills (Programming languages: Python, C++, Java; Operating Systems: Windows; Software Tools: MS Office, Git, Jira), as well as experience with IT environments. The job requires a strong affinity for IT, which the candidate possesses."
MER00043I2,JOB_MER00042FN,1,"Candidate has relevant technical skills (Python, C++, Java) and experience with IT environments, as well as a degree in Computer Science (Automotive Technology). The job requires release management and engineering change management experience, which the candidate can realistically be hired for."
MER00041FN,JOB_MER00043I2,1,"Candidate has relevant skills in CAD software, automotive design, and research experience. Also, the job description mentions 'Research and Development incl. Design', which aligns with the candidate's work experience."
MER00041FN,JOB_MER00041FN,1,"Candidate meets most requirements, including experience in automotive design, CAD software, and collaboration with cross-functional teams. Relevant skills include NX, SolidWorks, Autocad, and Catia CAD software."
MER00041FN,JOB_MER0003THB,0,"Candidate lacks relevant experience in AI and Data Science, primarily focusing on mechanical engineering and automotive design."
MER00041FN,JOB_MER00040G3,1,"Candidate has relevant experience in automotive engineering, research and development, and diagnostic tools. Mercedes-Benz Research and Development India Private Limited is the employer, making it a strong match."
MER00041FN,JOB_MER000440T,0,"Although candidate has mechanical engineering background, the job requires AD Backend Product Owner experience in autonomous driving and cloud-based solutions, which the candidate does not have."
MER00041FN,JOB_MER0003WC2,0,"Lack of direct experience in Active Safety systems, ADSAS functional requirement definition, and ASPICE process management. The candidate's expertise is more aligned with automotive design and development."
MER00041FN,JOB_494743,0,"Lack of relevant experience in management consulting and strategy, although the candidate has experience in automotive design and research."
MER00041FN,JOB_505890,0,"Lack of relevant skills in AI and Agentic Systems, despite experience in mechanical engineering and CAD software."
MER00041FN,JOB_504994,0,"The candidate lacks relevant experience in Artificial Intelligence and Machine Learning, as well as industry expertise in strategy, domain hands-on experience, and demonstrated ownership with AI applied to business or industrial data."
MER00041FN,JOB_MER00042W1,1,"Candidate has relevant experience in automotive design, CAD software, and research, with a strong background in mechanical engineering. Their skills match the job requirements."
MER00041FN,JOB_MER00040PN,0,"Lack of relevant work experience in labor and social law, despite working at Mercedes-Benz R&D India Private Limited."
MER00041FN,JOB_MER00043WJ,0,"Lack of relevant experience in assembly, electronics, and manufacturing quality methods. Limited experience with vans-specific products."
MER00041FN,JOB_MER00043NP,1,"Candidate's mechanical engineering background, experience in automotive design and CAD software, as well as their research experience, align with the job requirements for an Assembly Intern position at Mercedes-Benz Vans."
MER00041FN,JOB_MER00043AJ,0,"Lack of experience with exhaust gas turbocharging and specific expertise in Otto engine development. Although candidate has experience in R&D, design, and automotive products, the skills mentioned do not directly align with the job requirements."
MER00041FN,JOB_MER0003N2B,0,"Lack of experience in die casting and permanent gravity casting, with only general knowledge of metal basics and no direct connection to Mercedes-Benz standards."
MER00041FN,JOB_MER00043EC,0,"Candidate lacks direct experience in die casting, chill casting, and machining metal workpieces. While they have CAD software skills, the job requires hands-on experience with high-tech systems for production of die cast structural parts."
MER00041FN,JOB_MER00043CU,0,"Lack of relevant technical experience in electric vehicles, alternative drives, and mechatronics systems. The candidate's skills are mostly related to mechanical engineering and automotive design."
MER00041FN,JOB_MER0003PNG,1,"Candidate has relevant experience in automotive design, CAD software, and research, which aligns with the job requirements for a mechatronics engineer position. Additionally, their education background in Mechanical Engineering and Automotive Engineering suggests they have a solid foundation in mechanical principles."
MER00041FN,JOB_MER00042Z0,0,Lack of electrical and electronics engineering background; candidate has mechanical engineering background
MER00041FN,JOB_MER0003NBY,0,Lack of relevant work experience in industrial mechanics and automation. The candidate's skills are more aligned with automotive design and research.
MER00041FN,JOB_MER00043R5,0,"Candidate's skills and experience are not aligned with the job requirements, specifically lacking in body maintenance technology and painting knowledge."
MER00041FN,JOB_MER00043R1,1,"Candidate has experience in automotive design, CAD software, and research, which aligns with the job requirements. Their background in mechanical engineering also supports their potential to work on mechatronics and high-voltage technology for vans and commercial vehicles."
MER00041FN,JOB_MER0003NUV,0,"Candidate lacks hands-on experience in body and vehicle construction mechanics, with training being the primary focus."
MER00041FN,JOB_MER00043QA,0,"Lack of experience in body shop operations, door adjusting, and spot welding. Relevant skills in CAD software and automotive design."
MER00041FN,JOB_MER0003TE5,1,"Candidate has relevant experience in automotive design, CAD software, and research, which aligns with the job requirements. Additionally, their skills in communication, problem-solving, and leadership can be applied to a senior program manager role."
MER00041FN,JOB_MER0003T8G,0,"Lack of relevant experience in equipment management and production, with a focus on automotive design and CAD software. The candidate's skills are more aligned with engineering and research roles."
MER00041FN,JOB_MER0003UJ0,0,"Candidate lacks experience in automotive body repair and rework, which is a critical aspect of the Body Shop Rework Technician role."
MER00041FN,JOB_MER000418L,1,"Candidate has relevant work experience in automotive industry, including research and development, CAD software proficiency, and collaboration with cross-functional teams. Although the job description emphasizes a different department (Capacity Management) than the candidate's current role at Mercedes-Benz Research and Development India Private Limited, the skills listed in the job description are still transferable to the internship."
MER00041FN,JOB_MER000404I,0,"Lack of backend development experience and skills; relevant experience in mechanical engineering, research, and design"
MER00041FN,JOB_MER000404E,0,"Candidate lacks C#/.NET development experience, while the job requires 5 years of hands-on experience in ASP.NET C development."
MER00041FN,JOB_MER0003ZP6,1,"Candidate has relevant experience in CAD customization, automotive design, and .NET development, making them a suitable candidate for the role."
MER00041FN,JOB_MER000435L,0,"Lack of experience in product management, AI/ML platforms, and DevOps. No direct connection to the job description."
MER00041FN,JOB_MER0003Z0J,0,"Lack of experience in IT/Telecommunications domain and no mention of Spring Boot, Java, or programming skills in the CV. While candidate has experience with CAD software and automotive products, the job description requires expertise in web application development and IT/Telecommunications."
MER00041FN,JOB_MER00040VT,0,"No direct experience in Cloud Architecture, Senior Cloud Architect role requires extensive expertise in Azure PaaS, Container Services, Networking and Cloud Security, which is not evident from the candidate's CV."
MER00041FN,JOB_MER0003Y4X,0,"Lack of relevant technical skills: Senior Tech Lead requires expertise in Java, Spring Boot, Cloud, Kubernetes, and security. Rohan's experience is in Automotive Design, CAD software, and Research and Development, which are not directly applicable to this role."
MER00041FN,JOB_MER0003SBL,1,"Candidate has relevant experience in automotive design, CAD software, and research with Mercedes-Benz. Strong programming skills in Java and proficiency in Spring Boot aligns with the job requirements."
MER00041FN,JOB_MER0003PMN,0,"Candidate lacks experience in cloud computing and development operations, which are critical for this SRE - Observability Expert role."
MER00041FN,JOB_MER00043UE,0,"Although candidate has experience in CAD software and automotive industry, the job requires Java full stack development with microservices, which is not mentioned in their CV."
MER00041FN,JOB_505156,1,"Although the candidate has a strong technical background, the job description requires accounting and financial leadership skills that are not explicitly mentioned in the CV. However, the candidate's experience in leading teams and providing expert advice on complex financial constellations could be transferable to this role."
MER00041FN,JOB_504229,0,"Lack of relevant skills and experience in accounting, finance, or related fields. While the candidate has experience in research and development, automotive design, and CAD software, they do not have any direct experience in accounting or finance."
MER00041FN,JOB_504230,0,"Candidate lacks relevant work experience in accounting or finance, with no mention of SAP knowledge required by the job."
MER00041FN,JOB_MER0003S4Y,0,"Lacks required expertise in AI Security and related technologies. While candidate has experience in CAD software, it's not directly applicable to this role."
MER00041FN,JOB_MER0003S8I,0,"Lack of relevant experience in IT/Telecommunications and security domains. Despite expertise in automotive design, the skills don't translate directly to Information Security Consultant role."
MER00041FN,JOB_502282,0,"Candidate lacks relevant technical expertise in cybersecurity and incident response, despite having a strong background in mechanical engineering and CAD software."
MER00041FN,JOB_503304,0,"Job requires experience in Cloud DevOps, Cybersecurity, and AWS, whereas candidate has experience in Automotive Design, CAD software, and Mercedes-Benz standards."
MER00041FN,JOB_MER00042QP,0,"Candidate's expertise is in mechanical engineering, not business informatics/data science. No direct relation between job requirements and CV skills."
MER00041FN,JOB_502623,0,"Lack of experience in software development, data & AI, and scalable distributed systems. Mechanical Engineer background is not a direct match for Software Development Engineer - Data & AI role."
MER00041FN,JOB_MER0003TJ8,0,"Candidate lacks experience in finance and data science, which is a critical aspect of the Business Intelligence role. Although they have experience in automotive design and research, it does not directly translate to the required skills for this position."
MER00041FN,JOB_MER00041K9,1,"Candidate has relevant experience in Research and Development, CAD software, and automotive industry, which aligns with the job requirements."
MER00041FN,JOB_MER00042FN,1,"Candidate has relevant experience in product data management, documentation, and release processes through PLM tools like Teamcenter. Additionally, they have hands-on experience with automotive component release electronics hardware release and software release processes."
MER0003THB,JOB_MER00043I2,0,"Candidate lacks experience in automated driving and driving assistance systems, but has strong background in AI and machine learning, which is not directly relevant to the job requirements."
MER0003THB,JOB_MER00041FN,1,"Candidate has strong background in AI and machine learning, relevant skills such as Python, Java, and cloud platforms, and experience in designing and deploying scalable AI-powered prototypes"
MER0003THB,JOB_MER0003THB,1,"Candidate has strong background in AI and machine learning, relevant skills such as Python, Java, Scala, and cloud platforms like Azure, AWS, and AliCloud. Experience in developing and deploying scalable AI-powered prototypes and contributing to research and development."
MER0003THB,JOB_MER00040G3,0,"Lack of relevant automotive expertise and experience in diagnostics, despite strong AI/ML background."
MER0003THB,JOB_MER000440T,0,"Lack of experience in autonomous driving and backend product design, despite strong background in AI and machine learning."
MER0003THB,JOB_MER0003WC2,0,"Lack of experience in automotive industry, ADAS systems, and ROS/Autoware platforms. While candidate has experience in AI/ML, it's not directly applicable to the job requirements."
MER0003THB,JOB_494743,0,"Lack of relevant skills and experience in management consulting, AI/ML is not mentioned at all."
MER0003THB,JOB_505890,1,"Candidate has relevant technical skills, experience in AI and machine learning, and education background matching the job requirements."
MER0003THB,JOB_504994,1,"Candidate has strong background in AI and machine learning, with relevant experience in developing and deploying scalable AI-powered prototypes."
MER0003THB,JOB_MER00042W1,0,"Lack of relevant experience in automotive or research and development, with a strong background in AI and machine learning."
MER0003THB,JOB_MER00040PN,0,"Lack of relevant skills and experience in labor and social law. The candidate's background is in software engineering and AI, which does not align with the job requirements."
MER0003THB,JOB_MER00043WJ,0,"Lack of relevant skills and experience. No background in automotive manufacturing, electronics, or quality control."
MER0003THB,JOB_MER00043NP,0,"Candidate lacks relevant technical skills for the assembly internship, with no experience in manufacturing, lean manufacturing, or production process optimization."
MER0003THB,JOB_MER00043AJ,0,"Candidate lacks relevant experience and expertise in exhaust gas turbocharging, engine development, and vehicle technology, despite strong background in AI and machine learning."
MER0003THB,JOB_MER0003N2B,0,"Lack of relevant technical skills and experience in die casting, permanent gravity casting, or manufacturing. The candidate's background is in software engineering with expertise in AI, machine learning, and programming languages."
MER0003THB,JOB_MER00043EC,0,"Lack of relevant skills for die casting and chill casting, as well as metalworking experience. Software engineer background is not directly applicable to this role."
